{
  "bundle_version": "1.0.0",
  "schema_version": 1,
  "published_at": "2026-09-18T00:00:00Z",
  "checksum": "sha256:fallback-dev-bundle",
  "items": [
    { "id": "ammo_rifle",    "display_name": "Rifle Rounds",    "category": "ammo",       "stack_max": 90,  "weight": 0.02 },
    { "id": "ammo_smg",      "display_name": "SMG Rounds",      "category": "ammo",       "stack_max": 120, "weight": 0.01 },
    { "id": "ammo_shotgun",  "display_name": "Shells",          "category": "ammo",       "stack_max": 32,  "weight": 0.05 },
    { "id": "ammo_pistol",   "display_name": "Pistol Rounds",   "category": "ammo",       "stack_max": 60,  "weight": 0.01 },
    { "id": "ammo_sniper",   "display_name": "Long Rounds",     "category": "ammo",       "stack_max": 20,  "weight": 0.04 },
    { "id": "scrap_metal",   "display_name": "Scrap Metal",     "category": "material",   "stack_max": 20,  "weight": 0.5 },
    { "id": "cloth",         "display_name": "Cloth",           "category": "material",   "stack_max": 20,  "weight": 0.1 },
    { "id": "herb",          "display_name": "Bitter Herb",     "category": "material",   "stack_max": 20,  "weight": 0.05 },
    { "id": "gun_oil",       "display_name": "Gun Oil",         "category": "material",   "stack_max": 10,  "weight": 0.2 },
    { "id": "medkit_small",  "display_name": "Field Dressing",  "category": "consumable", "stack_max": 5,   "weight": 0.3 },
    { "id": "repair_kit",    "display_name": "Repair Kit",      "category": "tool",       "stack_max": 3,   "weight": 0.8 }
  ],
  "weapons": [
    { "id": "rifle_standard",  "display_name": "Service Rifle",   "class": "rifle",   "damage": 24.0, "fire_rate": 6.5,  "range": 40.0, "ammo_type": "ammo_rifle",   "magazine_size": 30, "reload_seconds": 2.4, "durability_max": 100, "durability_per_shot": 0.12, "noise_radius": 18.0, "suppressed": false },
    { "id": "smg_compact",     "display_name": "Compact SMG",     "class": "smg",     "damage": 14.0, "fire_rate": 11.0, "range": 22.0, "ammo_type": "ammo_smg",     "magazine_size": 35, "reload_seconds": 1.8, "durability_max": 90,  "durability_per_shot": 0.10, "noise_radius": 14.0, "suppressed": false },
    { "id": "shotgun_pump",    "display_name": "Pump Shotgun",    "class": "shotgun", "damage": 60.0, "fire_rate": 1.2,  "range": 12.0, "ammo_type": "ammo_shotgun", "magazine_size": 6,  "reload_seconds": 3.0, "durability_max": 120, "durability_per_shot": 0.40, "noise_radius": 24.0, "suppressed": false },
    { "id": "pistol_silenced", "display_name": "Silenced Pistol", "class": "pistol",  "damage": 18.0, "fire_rate": 4.0,  "range": 20.0, "ammo_type": "ammo_pistol",  "magazine_size": 12, "reload_seconds": 1.5, "durability_max": 80,  "durability_per_shot": 0.15, "noise_radius": 4.0,  "suppressed": true },
    { "id": "sniper_bolt",     "display_name": "Bolt Rifle",      "class": "sniper",  "damage": 95.0, "fire_rate": 0.8,  "range": 70.0, "ammo_type": "ammo_sniper",  "magazine_size": 5,  "reload_seconds": 3.2, "durability_max": 110, "durability_per_shot": 0.50, "noise_radius": 30.0, "suppressed": false },
    { "id": "carbine_scout",   "display_name": "Scout Carbine",   "class": "carbine", "damage": 20.0, "fire_rate": 5.0,  "range": 32.0, "ammo_type": "ammo_rifle",   "magazine_size": 20, "reload_seconds": 2.0, "durability_max": 100, "durability_per_shot": 0.10, "noise_radius": 16.0, "suppressed": false }
  ],
  "enemy_archetypes": [
    { "id": "grunt", "display_name": "Militia Grunt",  "max_hp": 80,  "move_speed": 3.2, "vision_range": 14.0, "vision_angle": 90.0,  "hearing_range": 12.0, "weapon_id": "rifle_standard", "alert_decay_seconds": 8.0,  "retreat_hp_threshold": 0.25, "loot_table_id": "loot_tier_1", "is_boss": false },
    { "id": "scout", "display_name": "Militia Scout",  "max_hp": 55,  "move_speed": 4.2, "vision_range": 20.0, "vision_angle": 110.0, "hearing_range": 16.0, "weapon_id": "carbine_scout",  "alert_decay_seconds": 6.0,  "retreat_hp_threshold": 0.40, "loot_table_id": "loot_tier_1", "is_boss": false },
    { "id": "heavy", "display_name": "Militia Heavy",  "max_hp": 160, "move_speed": 2.4, "vision_range": 12.0, "vision_angle": 80.0,  "hearing_range": 10.0, "weapon_id": "shotgun_pump",   "alert_decay_seconds": 10.0, "retreat_hp_threshold": 0.15, "loot_table_id": "loot_tier_2", "is_boss": false },
    { "id": "boss_commander", "display_name": "Commander Varek", "max_hp": 600, "move_speed": 3.6, "vision_range": 18.0, "vision_angle": 120.0, "hearing_range": 18.0, "weapon_id": "smg_compact", "alert_decay_seconds": 999.0, "retreat_hp_threshold": 0.0, "loot_table_id": "loot_tier_3", "is_boss": true,
      "boss": { "health_multiplier": 3.0, "damage_multiplier": 1.6, "vision_multiplier": 1.2,
                "relocate_interval_seconds": 12.0, "relocate_damage_fraction": 0.15, "relocate_min_distance": 6.0, "relocate_max_distance": 22.0, "relocate_min_player_distance": 8.0,
                "grenade_camp_seconds": 4.0, "grenade_camp_radius": 3.0, "grenade_cooldown_seconds": 10.0, "grenade_range": 24.0, "grenade_radius": 4.5, "grenade_damage": 35.0, "grenade_fuse_seconds": 1.2, "grenade_noise_radius": 30.0,
                "reinforce_hp_threshold": 0.5, "reinforce_count": 3, "reinforce_radius": 80.0 } }
  ],
  "loot_tables": [
    { "id": "loot_tier_1", "tier": 1, "rolls": 2, "entries": [
      { "item_id": "ammo_rifle",   "weight": 40, "min": 5, "max": 15 },
      { "item_id": "ammo_smg",     "weight": 20, "min": 10, "max": 25 },
      { "item_id": "scrap_metal",  "weight": 25, "min": 1, "max": 3 },
      { "item_id": "cloth",        "weight": 25, "min": 1, "max": 2 },
      { "item_id": "medkit_small", "weight": 10, "min": 1, "max": 1 }
    ]},
    { "id": "loot_tier_2", "tier": 2, "rolls": 3, "entries": [
      { "item_id": "ammo_shotgun", "weight": 30, "min": 4, "max": 8 },
      { "item_id": "ammo_pistol",  "weight": 25, "min": 6, "max": 12 },
      { "item_id": "gun_oil",      "weight": 20, "min": 1, "max": 1 },
      { "item_id": "herb",         "weight": 20, "min": 1, "max": 3 },
      { "item_id": "repair_kit",   "weight": 5,  "min": 1, "max": 1 }
    ]},
    { "id": "loot_tier_3", "tier": 3, "rolls": 4, "entries": [
      { "item_id": "ammo_sniper",  "weight": 30, "min": 3, "max": 6 },
      { "item_id": "repair_kit",   "weight": 25, "min": 1, "max": 2 },
      { "item_id": "medkit_small", "weight": 25, "min": 1, "max": 2 },
      { "item_id": "gun_oil",      "weight": 20, "min": 1, "max": 2 }
    ]}
  ],
  "craft_recipes": [
    { "id": "craft_medkit_small", "output_item_id": "medkit_small", "output_count": 1, "required_skill": "engineering", "required_skill_level": 1, "craft_seconds": 4.0,
      "inputs": [ { "item_id": "cloth", "count": 2 }, { "item_id": "herb", "count": 1 } ] },
    { "id": "craft_repair_kit",   "output_item_id": "repair_kit",   "output_count": 1, "required_skill": "engineering", "required_skill_level": 2, "craft_seconds": 6.0,
      "inputs": [ { "item_id": "scrap_metal", "count": 3 }, { "item_id": "gun_oil", "count": 1 } ] },
    { "id": "craft_ammo_pistol",  "output_item_id": "ammo_pistol",  "output_count": 12, "required_skill": "engineering", "required_skill_level": 1, "craft_seconds": 3.0,
      "inputs": [ { "item_id": "scrap_metal", "count": 2 } ] }
  ],
  "quests": [
    { "id": "quest_docks_recon", "title": "Eyes on the Docks", "description": "Reach the crane overlook without raising the alarm and get out.", "giver_npc_id": "npc_quartermaster", "map_id": "map01_docks",
      "objectives": [
        { "id": "reach_overlook", "type": "reach_node", "target_id": "9", "count": 1 },
        { "id": "escape",         "type": "escape_map", "target_id": "map01_docks", "count": 1 }
      ],
      "rewards": [ { "item_id": "ammo_rifle", "count": 30 }, { "item_id": "medkit_small", "count": 1 } ] }
  ],
  "maps": [
    { "id": "map01_docks", "display_name": "Saltreach Docks", "scene_name": "Map01_Docks", "player_start_node": 0, "boss_archetype_id": null,
      "spawn_groups": [
        { "squad_id": "squad_a", "archetype_id": "grunt", "count": 3, "start_nodes": [6, 7, 8] },
        { "squad_id": "squad_a", "archetype_id": "scout", "count": 1, "start_nodes": [10] }
      ],
      "loot_placements": [
        { "container_id": "crate_pier_1", "loot_table_id": "loot_tier_1", "node": 3 },
        { "container_id": "crate_warehouse", "loot_table_id": "loot_tier_2", "node": 7 }
      ],
      "escape_routes": [9, 11],
      "nav_graph_nodes": [
        { "id": 0,  "x": 0,  "y": 0, "z": 0,  "is_cover": false, "cover_facing": 0,   "neighbors": [1, 2] },
        { "id": 1,  "x": 6,  "y": 0, "z": 0,  "is_cover": true,  "cover_facing": 90,  "neighbors": [0, 3, 4] },
        { "id": 2,  "x": 0,  "y": 0, "z": 6,  "is_cover": true,  "cover_facing": 0,   "neighbors": [0, 4, 5] },
        { "id": 3,  "x": 12, "y": 0, "z": 0,  "is_cover": false, "cover_facing": 0,   "neighbors": [1, 6] },
        { "id": 4,  "x": 6,  "y": 0, "z": 6,  "is_cover": false, "cover_facing": 0,   "neighbors": [1, 2, 7] },
        { "id": 5,  "x": 0,  "y": 0, "z": 12, "is_cover": true,  "cover_facing": 180, "neighbors": [2, 8] },
        { "id": 6,  "x": 18, "y": 0, "z": 0,  "is_cover": true,  "cover_facing": 270, "neighbors": [3, 9] },
        { "id": 7,  "x": 12, "y": 0, "z": 12, "is_cover": true,  "cover_facing": 45,  "neighbors": [4, 8, 9, 10] },
        { "id": 8,  "x": 0,  "y": 0, "z": 18, "is_cover": false, "cover_facing": 0,   "neighbors": [5, 7, 11] },
        { "id": 9,  "x": 18, "y": 0, "z": 12, "is_cover": false, "cover_facing": 0,   "neighbors": [6, 7, 10] },
        { "id": 10, "x": 18, "y": 0, "z": 18, "is_cover": true,  "cover_facing": 225, "neighbors": [7, 9, 11] },
        { "id": 11, "x": 6,  "y": 0, "z": 22, "is_cover": false, "cover_facing": 0,   "neighbors": [8, 10] }
      ]
    }
  ],
  "ai_settings": {
    "default_solver_variant": "greedy",
    "latency_budget_ms": 120,
    "replan_cooldown_ms": 800,
    "weight_coverage": 1.0,
    "weight_redundancy": 0.5,